{
  "data_class": "ILLUSTRATIVE_EXAMPLE",
  "engine_version": "0.1.0",
  "state_version": 12,
  "updated_at": "2026-05-12T12:00:00Z",
  "commit": null,
  "last_pack_id": "PACK_12",
  "controls": {
    "detectors": [
      {
        "id": "det.clause-parse",
        "name": "Clause parse completeness",
        "kind": "deterministic",
        "failure_modes": [
          "fm.unparsed-clause"
        ],
        "products": [
          "deadlinesf"
        ],
        "added_by_pack": "PACK_01"
      },
      {
        "id": "det.evidence-complete",
        "name": "Evidence field completeness",
        "kind": "deterministic",
        "failure_modes": [
          "fm.thin-evidence"
        ],
        "products": [
          "deadlinesf",
          "billrosetta"
        ],
        "added_by_pack": "PACK_02"
      },
      {
        "id": "det.replay-identity",
        "name": "Replay byte-identity",
        "kind": "deterministic",
        "failure_modes": [
          "fm.nondeterministic-output"
        ],
        "products": [
          "deadlinesf",
          "billrosetta",
          "venturepilotai"
        ],
        "added_by_pack": "PACK_03"
      },
      {
        "id": "det.citation-resolves",
        "name": "Citation resolves to a pinned source",
        "kind": "deterministic",
        "failure_modes": [
          "fm.dangling-citation"
        ],
        "products": [
          "deadlinesf",
          "cited"
        ],
        "added_by_pack": "PACK_04"
      },
      {
        "id": "det.jurisdiction-scope",
        "name": "Jurisdiction in scope",
        "kind": "deterministic",
        "failure_modes": [
          "fm.out-of-scope-answer"
        ],
        "products": [
          "deadlinesf",
          "billrosetta"
        ],
        "added_by_pack": "PACK_05"
      },
      {
        "id": "det.rule-conflict",
        "name": "Conflicting rule outcomes",
        "kind": "deterministic",
        "failure_modes": [
          "fm.rule-conflict"
        ],
        "products": [
          "deadlinesf",
          "billrosetta"
        ],
        "added_by_pack": "PACK_06"
      },
      {
        "id": "det.authority-boundary",
        "name": "Authority boundary enforcement",
        "kind": "deterministic",
        "failure_modes": [
          "fm.authority-overreach"
        ],
        "products": [
          "deadlinesf"
        ],
        "added_by_pack": "PACK_07"
      },
      {
        "id": "det.effective-window",
        "name": "Effective-date window",
        "kind": "deterministic",
        "failure_modes": [
          "fm.stale-rule-version"
        ],
        "products": [
          "deadlinesf",
          "billrosetta",
          "goldtrac"
        ],
        "added_by_pack": "PACK_08"
      },
      {
        "id": "det.nested-exemption",
        "name": "Nested exemption resolution",
        "kind": "deterministic",
        "failure_modes": [
          "fm.nested-exemption"
        ],
        "products": [
          "deadlinesf",
          "billrosetta"
        ],
        "added_by_pack": "PACK_09"
      },
      {
        "id": "det.disbursement-authz",
        "name": "Disbursement authorization match",
        "kind": "deterministic",
        "failure_modes": [
          "fm.unauthorized-disbursement"
        ],
        "products": [
          "billrosetta-capital",
          "billrosetta"
        ],
        "added_by_pack": "PACK_10"
      },
      {
        "id": "det.authz-chain",
        "name": "Authorization chain integrity",
        "kind": "deterministic",
        "failure_modes": [
          "fm.broken-authz-chain"
        ],
        "products": [
          "billrosetta-capital"
        ],
        "added_by_pack": "PACK_10"
      },
      {
        "id": "det.nonce-freshness",
        "name": "Nonce freshness",
        "kind": "deterministic",
        "failure_modes": [
          "fm.receipt-replay"
        ],
        "products": [
          "billrosetta-capital",
          "bopcart",
          "venturepilotai"
        ],
        "added_by_pack": "PACK_11"
      },
      {
        "id": "det.receipt-uniqueness",
        "name": "Receipt uniqueness",
        "kind": "deterministic",
        "failure_modes": [
          "fm.duplicate-receipt"
        ],
        "products": [
          "billrosetta-capital",
          "bopcart",
          "venturepilotai"
        ],
        "added_by_pack": "PACK_11"
      }
    ],
    "regression_tests": [
      {
        "id": "t.clause-parse.01",
        "status": "PASS",
        "covers_detector": "det.clause-parse",
        "covers_failure_mode": "fm.unparsed-clause",
        "added_by_pack": "PACK_01"
      },
      {
        "id": "t.clause-parse.02",
        "status": "PASS",
        "covers_detector": "det.clause-parse",
        "covers_failure_mode": "fm.unparsed-clause",
        "added_by_pack": "PACK_01"
      },
      {
        "id": "t.clause-parse.03",
        "status": "PASS",
        "covers_detector": "det.clause-parse",
        "covers_failure_mode": "fm.unparsed-clause",
        "added_by_pack": "PACK_01"
      },
      {
        "id": "t.clause-parse.04",
        "status": "PASS",
        "covers_detector": "det.clause-parse",
        "covers_failure_mode": "fm.unparsed-clause",
        "added_by_pack": "PACK_01"
      },
      {
        "id": "t.evidence.01",
        "status": "PASS",
        "covers_detector": "det.evidence-complete",
        "covers_failure_mode": "fm.thin-evidence",
        "added_by_pack": "PACK_02"
      },
      {
        "id": "t.evidence.02",
        "status": "PASS",
        "covers_detector": "det.evidence-complete",
        "covers_failure_mode": "fm.thin-evidence",
        "added_by_pack": "PACK_02"
      },
      {
        "id": "t.evidence.03",
        "status": "PASS",
        "covers_detector": "det.evidence-complete",
        "covers_failure_mode": "fm.thin-evidence",
        "added_by_pack": "PACK_02"
      },
      {
        "id": "t.evidence.04",
        "status": "PASS",
        "covers_detector": "det.evidence-complete",
        "covers_failure_mode": "fm.thin-evidence",
        "added_by_pack": "PACK_02"
      },
      {
        "id": "t.evidence.05",
        "status": "PASS",
        "covers_detector": "det.evidence-complete",
        "covers_failure_mode": "fm.thin-evidence",
        "added_by_pack": "PACK_02"
      },
      {
        "id": "t.replay.01",
        "status": "PASS",
        "covers_detector": "det.replay-identity",
        "covers_failure_mode": "fm.nondeterministic-output",
        "added_by_pack": "PACK_03"
      },
      {
        "id": "t.replay.02",
        "status": "PASS",
        "covers_detector": "det.replay-identity",
        "covers_failure_mode": "fm.nondeterministic-output",
        "added_by_pack": "PACK_03"
      },
      {
        "id": "t.replay.03",
        "status": "PASS",
        "covers_detector": "det.replay-identity",
        "covers_failure_mode": "fm.nondeterministic-output",
        "added_by_pack": "PACK_03"
      },
      {
        "id": "t.replay.04",
        "status": "PASS",
        "covers_detector": "det.replay-identity",
        "covers_failure_mode": "fm.nondeterministic-output",
        "added_by_pack": "PACK_03"
      },
      {
        "id": "t.replay.05",
        "status": "PASS",
        "covers_detector": "det.replay-identity",
        "covers_failure_mode": "fm.nondeterministic-output",
        "added_by_pack": "PACK_03"
      },
      {
        "id": "t.replay.06",
        "status": "PASS",
        "covers_detector": "det.replay-identity",
        "covers_failure_mode": "fm.nondeterministic-output",
        "added_by_pack": "PACK_03"
      },
      {
        "id": "t.citation.01",
        "status": "PASS",
        "covers_detector": "det.citation-resolves",
        "covers_failure_mode": "fm.dangling-citation",
        "added_by_pack": "PACK_04"
      },
      {
        "id": "t.citation.02",
        "status": "PASS",
        "covers_detector": "det.citation-resolves",
        "covers_failure_mode": "fm.dangling-citation",
        "added_by_pack": "PACK_04"
      },
      {
        "id": "t.citation.03",
        "status": "PASS",
        "covers_detector": "det.citation-resolves",
        "covers_failure_mode": "fm.dangling-citation",
        "added_by_pack": "PACK_04"
      },
      {
        "id": "t.citation.04",
        "status": "PASS",
        "covers_detector": "det.citation-resolves",
        "covers_failure_mode": "fm.dangling-citation",
        "added_by_pack": "PACK_04"
      },
      {
        "id": "t.citation.05",
        "status": "PASS",
        "covers_detector": "det.citation-resolves",
        "covers_failure_mode": "fm.dangling-citation",
        "added_by_pack": "PACK_04"
      },
      {
        "id": "t.refusal.01",
        "status": "PASS",
        "covers_detector": "det.jurisdiction-scope",
        "covers_failure_mode": "fm.out-of-scope-answer",
        "added_by_pack": "PACK_05"
      },
      {
        "id": "t.refusal.02",
        "status": "PASS",
        "covers_detector": "det.jurisdiction-scope",
        "covers_failure_mode": "fm.out-of-scope-answer",
        "added_by_pack": "PACK_05"
      },
      {
        "id": "t.refusal.03",
        "status": "PASS",
        "covers_detector": "det.jurisdiction-scope",
        "covers_failure_mode": "fm.out-of-scope-answer",
        "added_by_pack": "PACK_05"
      },
      {
        "id": "t.refusal.04",
        "status": "PASS",
        "covers_detector": "det.jurisdiction-scope",
        "covers_failure_mode": "fm.out-of-scope-answer",
        "added_by_pack": "PACK_05"
      },
      {
        "id": "t.refusal.05",
        "status": "PASS",
        "covers_detector": "det.jurisdiction-scope",
        "covers_failure_mode": "fm.out-of-scope-answer",
        "added_by_pack": "PACK_05"
      },
      {
        "id": "t.refusal.06",
        "status": "PASS",
        "covers_detector": "det.jurisdiction-scope",